<?xml version="1.0" encoding="UTF-8"?>

<receta xmlns:xsi="http://www.w3.org/2001/XMLSchema-instance"
    xsi:noNamespaceSchemaLocation="ejemplo01.xsd">

    <medicamento>Paracetamol</medicamento>
    <medicamento>Omeprazol</medicamento>

    <farmacia>Farmacia Juaneda</farmacia>

    <edad>70</edad>

    <nombre>Francisco Santos</nombre>

    <pago>Gratuito</pago>

    <dni>10918186q</dni>

    <precio>16.51</precio>

    <medico numColegiado="171612713">Juan Ríos</medico>

</receta>